{"geometry_cache_bytes":33554432,"layer_memory_bytes":67108864,"maximum_cut_bytes":268435456,"maximum_cut_cache_entries":128,"maximum_object_bytes":134217728,"maximum_output_bytes":268435456,"maximum_qc_cut_bytes":536870912,"maximum_scratch_bytes":4294967296,"maximum_sweeps":64,"maximum_task_gates":768000000,"maximum_tile_bytes":134217728,"maximum_volume_gates":64000000,"scratch_parent":null,"selection_backend":"numpy","streaming":false,"version":"multiband-cpu-stream-20260925-v1"}
